{
  "$schema": "http://json-schema.org/draft-07/schema#",
  "$id": "https://github.com/LucaDominici/forma/blob/main/lib/schema/forma.room.schema.json",
  "title": "forma.room.json — portfolio manifest for `forma room`",
  "description": "What makes the Control Room parametric instead of hand-cut per portfolio: another program changes only this file. `today` is a determinism anchor — room/check/room-presentable never call Date.now(); every run is pinned to the date this file names.",
  "type": "object",
  "required": ["today", "programs"],
  "additionalProperties": false,
  "properties": {
    "today": { "type": "string", "pattern": "^\\d{4}-\\d{2}-\\d{2}$" },
    "title": { "type": "string", "description": "Control Room page title. Never inherited from model.meta.title, which describes an architecture snapshot, not the room." },
    "theme": { "type": "string", "enum": ["dark", "light"], "description": "Control Room color theme. Default light; dark remains opt-in." },
    "staleAfterDays": { "type": "integer", "minimum": 1, "description": "room-presentable fails if c4-issues.json.fetchedAt is older than this many days before `today`. Default 14." },
    "linkMaxFiles": { "type": "integer", "minimum": 1, "description": "A commit touching more files than this is a sweep and attributes to no node (still counted, named in `tec`). Default 50." },
    "docs": {
      "type": "object",
      "additionalProperties": false,
      "properties": {
        "maxBytes": { "type": "integer", "minimum": 0, "description": "Caps document bytes read across the portfolio so room generation stays bounded." }
      }
    },
    "programs": {
      "type": "array",
      "minItems": 1,
      "items": {
        "type": "object",
        "required": ["id", "ghRepo", "repo", "issues"],
        "additionalProperties": false,
        "properties": {
          "id": { "type": "string", "pattern": "^[a-z0-9][a-z0-9._-]*$", "description": "Stable program key used to join portfolio data without depending on a display name." },
          "enabled": { "type": "boolean", "description": "Default true. A program set to false stays in the manifest and out of the briefing, and the Options view names it as deliberately excluded — deleting the entry would lose that distinction, and `forma scan` never overwrites a false." },
          "ghRepo": { "type": "string", "pattern": "^[^/\\s]+/[^/\\s]+$" },
          "repo": { "type": "string", "description": "Filesystem path to the checkout. Relative paths resolve against the manifest file's own directory so invocation location cannot change the target." },
          "issues": { "type": "string", "description": "Path to this program's c4-issues.json fact base." },
          "model": { "type": "string", "description": "Path to this program's architecture model when it participates in the room." },
          "topology": { "type": "string", "description": "Path to this program's topology overlay when one exists." },
          "health": { "type": "string", "description": "Path to this program's health overlay when one exists." },
          "findings": { "type": "string", "description": "Path to this program's findings overlay when one exists." },
          "auditPlan": { "type": "string", "description": "Offline audit plan written by `room update --counter` / `--fill` (prompts for the agent, claims for the counter-verifier)." },
          "counterResults": { "type": "string", "description": "Agent-written counter-verification results consumed by `room update --counter`." },
          "auditFill": { "type": "string", "description": "Agent-written audit fill (verdicts, findings, brief claims) consumed by `room update --fill`. Applied item by item; refusals are named in the health overlay's lastApply." },
          "brief": {
            "type": "object",
            "description": "The judgement layer of this programme, opt-in by presence: thesis, risks, decisions, invariants, notes — typed claims that expire and are coloured only under a fresh hostile verdict. See c4-brief.schema.json.",
            "required": ["path"],
            "additionalProperties": false,
            "properties": {
              "path": { "type": "string", "description": "Path to this program's c4-brief.json overlay." },
              "previous": { "type": "string", "pattern": "^[0-9a-f]{7,40}$", "description": "Commit that holds the previous brief; the \"what changed\" panel diffs `git show <previous>:<path>` against the current file. A declared input, so the delta is derived, never a stored register." }
            }
          },
          "workflows": {
            "type": "array",
            "description": "Repository workflow lanes collected by `forma verify`; names and paths are programme data, never engine constants.",
            "items": {
              "type": "object",
              "required": ["id", "path"],
              "additionalProperties": false,
              "properties": {
                "id": { "type": "string", "pattern": "^[a-z0-9][a-z0-9._-]*$" },
                "path": { "type": "string", "pattern": "\\S" }
              }
            }
          },
          "release": { "type": "boolean", "description": "Opt in to collecting the latest GitHub release and the commit its tag resolves to." },
          "capabilities": {
            "type": "object",
            "required": ["docs", "statusMap"],
            "additionalProperties": false,
            "description": "Capability ledger derived on every room/check run. Rich source statuses are mapped explicitly and their original text is preserved.",
            "properties": {
              "docs": {
                "type": "array",
                "minItems": 1,
                "items": {
                  "type": "object",
                  "required": ["path"],
                  "additionalProperties": false,
                  "properties": {
                    "path": { "type": "string", "pattern": "\\S" },
                    "id": { "type": "string" },
                    "describe": { "type": "string" },
                    "status": { "type": "string" },
                    "ref": { "type": "string" },
                    "issues": { "type": "string" },
                    "release": { "type": "string" },
                    "parents": { "type": "string" },
                    "roots": { "type": "array", "items": { "type": "string" } }
                  }
                }
              },
              "statusMap": { "type": "object", "minProperties": 1, "additionalProperties": { "type": "string", "pattern": "\\S" } },
              "verification": {
                "type": "object",
                "required": ["path"],
                "additionalProperties": false,
                "description": "Optional RTM execution table joined to ledger rows by feature or use-case id.",
                "properties": {
                  "path": { "type": "string", "pattern": "\\S" },
                  "feature": { "type": "string" },
                  "useCase": { "type": "string" },
                  "verdict": { "type": "string" },
                  "execution": { "type": "string" },
                  "test": { "type": "string" },
                  "requirement": { "type": "string" }
                }
              }
            }
          },
          "blockedBy": {
            "type": "object",
            "additionalProperties": false,
            "description": "Declares what 'waiting on a human' means for this program; lib/ never infers it. Measured reality differs: haben uses needs-human, arbiter uses needs-human plus owner-decision, and viafera has no such label because status:parked means deliberately stopped, not waiting.",
            "properties": {
              "labels": { "type": "array", "items": { "type": "string" } }
            }
          },
          "docs": {
            "type": "object",
            "additionalProperties": false,
            "properties": {
              "include": { "type": "array", "items": { "type": "string" }, "description": "Globs selecting only git-tracked files, so generated or local files cannot silently enter the room." },
              "canon": { "type": "array", "items": { "type": "string" }, "description": "Paths carried in full, in this order, so a reading order somebody chose survives into the page. Everything else `include` selects is listed with a link but not embedded. A canon document that would exceed docs.maxBytes is listed with that as its reason, never truncated." },
              "gate": {
                "type": "object",
                "required": ["invariants"],
                "additionalProperties": false,
                "description": "Opt-in extraction contract for the deterministic document gate. This declares sources only; severity and enforcement truth are derived later.",
                "properties": {
                  "invariants": {
                    "type": "array",
                    "minItems": 1,
                    "items": {
                      "type": "object",
                      "required": ["path", "idPattern"],
                      "additionalProperties": false,
                      "properties": {
                        "path": { "type": "string", "pattern": "\\S" },
                        "idPattern": { "type": "string", "pattern": "\\S", "description": "Regex applied to each Markdown heading without its # prefix. A named `id` group, then the first capture, then the full match supplies the invariant id." }
                      }
                    }
                  },
                  "registry": {
                    "type": "array",
                    "minItems": 1,
                    "items": { "type": "string", "pattern": "\\S" },
                    "description": "Repo-relative files that contain the real gate registry. Their lines are extracted verbatim; merely naming a token never proves enforcement."
                  },
                  "wiring": {
                    "type": "array",
                    "description": "Invariant-specific proof: a declared regex must match a declared registry. Generic token occurrence is never treated as wiring.",
                    "items": {
                      "type": "object",
                      "required": ["invariant", "registry", "pattern"],
                      "additionalProperties": false,
                      "properties": {
                        "invariant": { "type": "string", "pattern": "\\S" },
                        "registry": { "type": "string", "pattern": "\\S" },
                        "pattern": { "type": "string", "pattern": "\\S" }
                      }
                    }
                  },
                  "claims": {
                    "type": "array",
                    "description": "Explicit document claims whose captured value must resolve to a tracked path, tracked-file count, or JSON pointer.",
                    "items": {
                      "type": "object",
                      "required": ["id", "path", "pattern", "type"],
                      "anyOf": [
                        { "required": ["type"], "properties": { "type": { "enum": ["path"] } } },
                        { "required": ["type", "include"], "properties": { "type": { "enum": ["tracked-count"] } } },
                        { "required": ["type", "target", "pointer"], "properties": { "type": { "enum": ["json"] } } }
                      ],
                      "additionalProperties": false,
                      "properties": {
                        "id": { "type": "string", "pattern": "^[a-z0-9][a-z0-9._-]*$" },
                        "path": { "type": "string", "pattern": "\\S" },
                        "pattern": { "type": "string", "pattern": "\\S" },
                        "capture": { "type": "integer", "minimum": 0 },
                        "type": { "type": "string", "enum": ["path", "tracked-count", "json"] },
                        "target": { "type": "string", "pattern": "\\S" },
                        "pointer": { "type": "string", "pattern": "^/" },
                        "include": { "type": "array", "minItems": 1, "items": { "type": "string", "pattern": "\\S" } }
                      }
                    }
                  },
                  "freshness": {
                    "type": "array",
                    "minItems": 1,
                    "items": {
                      "type": "object",
                      "required": ["id", "include", "staleAfterDays"],
                      "additionalProperties": false,
                      "properties": {
                        "id": { "type": "string", "pattern": "^[a-z0-9][a-z0-9._-]*$" },
                        "include": { "type": "array", "minItems": 1, "items": { "type": "string", "pattern": "\\S" } },
                        "staleAfterDays": { "type": "integer", "minimum": 1 }
                      }
                    }
                  }
                }
              }
            }
          },
          "rtm": {
            "type": "object",
            "additionalProperties": false,
            "required": ["docs"],
            "description": "The requirements traceability matrix, opt-in by presence: a program that declares no rtm derives none and sees none of its four gate assertions. Paths are relative to the PROGRAM'S checkout, not the manifest — docs/PRD.md means that repository's PRD.",
            "properties": {
              "docs": {
                "type": "array",
                "minItems": 1,
                "items": {
                  "type": "object",
                  "required": ["path"],
                  "additionalProperties": false,
                  "properties": {
                    "path": { "type": "string", "description": "Repo-relative markdown file. Must be tracked by git, or its rows never enter the matrix and the document is named as skipped." },
                    "idPattern": { "type": "string", "description": "Regex an id cell must match for its row to be a requirement, e.g. \"^R-\\\\d+$\". A column called id that does not match is a different table, not a near miss to repair." },
                    "role": { "type": "string", "description": "What this document contributes to the chain: requirement, design, feasibility, verification. Free text — lib/ never enumerates one project's stages." },
                    "id": { "type": "string", "description": "Header name of the id column, when it is not auto-detected." },
                    "describe": { "type": "string", "description": "Header name of the text column, when it is not auto-detected." },
                    "satisfies": { "type": "string", "description": "Header name of the upstream-reference column, when it is not auto-detected." },
                    "verified": { "type": "string", "description": "Header name of the verification column, when it is not auto-detected." },
                    "issues": { "type": "string", "description": "Header name of the issue column, when it is not auto-detected." }
                  }
                }
              },
              "requireIssuesFrom": {
                "type": "array",
                "items": { "type": "string" },
                "description": "Document paths whose rows MUST land on GitHub issues or name a verification. Presence also declares that the matrix is the complete WBS, so uncited open issues fail `forma check`. Omit it for an informational, auto-discovered matrix."
              }
            }
          },
          "taxonomy": {
            "type": "object",
            "additionalProperties": false,
            "properties": {
              "alias": {
                "type": "object",
                "additionalProperties": true,
                "description": "family -> {rawValue: canonicalValue}, e.g. {\"priority\": {\"P2\": \"p2\", \"high\": \"p1\"}}."
              },
              "order": {
                "type": "object",
                "additionalProperties": true,
                "description": "family -> values ordered most severe first, e.g. {\"priority\": [\"P0\", \"P1\", \"P2\"]}. Values not listed sort after every declared value."
              },
              "exclude": { "type": "array", "items": { "type": "string" }, "description": "Label families to never promote to an axis, however populated." },
              "minPopulation": { "type": "integer", "minimum": 1, "description": "A family below this many labeled issues stays in the named 'other' bucket. Default 3." }
            }
          }
        }
      }
    }
  }
}
