{
  "today": "2026-08-18",
  "title": "Forma · portfolio briefing",
  "theme": "dark",
  "staleAfterDays": 14,
  "linkMaxFiles": 50,
  "docs": {
    "maxBytes": 120000
  },
  "programs": [
    {
      "id": "forma",
      "ghRepo": "LucaDominici/forma",
      "repo": ".",
      "issues": "docs/architecture/c4-issues.json",
      "model": "docs/architecture/c4-model.json",
      "topology": "docs/architecture/c4-topology.json",
      "workflows": [
        {
          "id": "ci",
          "path": ".github/workflows/ci.yml"
        }
      ],
      "release": true,
      "blockedBy": {
        "labels": []
      },
      "rtm": {
        "docs": [
          {
            "path": "docs/PRD.md",
            "idPattern": "^R-\\d+$",
            "role": "requirement"
          }
        ],
        "requireIssuesFrom": []
      },
      "docs": {
        "include": [
          "docs/*.md",
          "docs/adr/*.md"
        ],
        "canon": [
          "docs/PRD.md",
          "docs/DESIGN.md",
          "docs/GLOBAL_INVARIANTS.md",
          "docs/DELIVERY.md",
          "docs/FEASIBILITY.md",
          "docs/GOVERNANCE.md",
          "docs/GLOSSARY.md",
          "docs/technical-debt.md"
        ],
        "gate": {
          "invariants": [
            {
              "path": "docs/GLOBAL_INVARIANTS.md",
              "idPattern": "^(I\\d+)\\."
            }
          ],
          "registry": [
            "package.json",
            ".github/workflows/ci.yml",
            "lib/check.mjs",
            "test/run.mjs",
            "test/gen.test.mjs",
            "test/room.test.mjs",
            "test/briefing.test.mjs"
          ],
          "wiring": [
            {
              "invariant": "I12",
              "registry": "test/gen.test.mjs",
              "pattern": "gen x2 should differ on generatedAt only"
            },
            {
              "invariant": "I12",
              "registry": "test/room.test.mjs",
              "pattern": "two renders of the same manifest are not byte-identical"
            },
            {
              "invariant": "I15",
              "registry": "test/briefing.test.mjs",
              "pattern": "keys present in en and missing from it"
            },
            {
              "invariant": "I15",
              "registry": "test/briefing.test.mjs",
              "pattern": "declared but never read by the template"
            },
            {
              "invariant": "I15",
              "registry": "test/briefing.test.mjs",
              "pattern": "never reaches fmt"
            }
          ],
          "claims": [
            {
              "id": "doc-style-grader",
              "path": "DECISION_REGISTRY.md",
              "pattern": "^Enforcement: `lib/render\\.mjs`[^;]*;[^`]*`([^`]+)`",
              "type": "path"
            },
            {
              "id": "lint-file-count",
              "path": "docs/DELIVERY.md",
              "pattern": "checks (\\d+) files through",
              "type": "tracked-count",
              "include": [
                "bin/forma.mjs",
                "lib/*.mjs",
                "scripts/*.mjs",
                "test/*.mjs"
              ]
            },
            {
              "id": "release-version",
              "path": "docs/DELIVERY.md",
              "pattern": "The ([0-9]+\\.[0-9]+\\.[0-9]+) release candidate",
              "type": "json",
              "target": "package.json",
              "pointer": "/version"
            }
          ],
          "freshness": [
            {
              "id": "governance",
              "include": [
                "docs/*.md"
              ],
              "staleAfterDays": 120
            }
          ]
        }
      },
      "health": "docs/architecture/c4-health.json",
      "findings": "docs/architecture/c4-findings.json",
      "auditPlan": "docs/architecture/audit-plan.json",
      "auditFill": "docs/architecture/audit-fill.json",
      "counterResults": "docs/architecture/audit-counter.json",
      "brief": {
        "path": "docs/architecture/c4-brief.json",
        "previous": "3ebe4a6"
      }
    }
  ]
}
